text,label,sentence_variation,%stop_word_total,mean_word_length,%adjectives_total
dictatorship democracy power cooperation military interventions early morning december 20 1989 archibold united states began mission would fundamentally change nature american interventionism years come targeting narcokleptocratic regime panamanian strongman manuel noriega moreno operation cause mission meticulously organized beginning policies collaborative interagency efforts us foreign service department defense cannot said us intervention somalia three years later defined communication barriers lack appropriate interagency planning operation restore hope yielded humanitarian situation little improved politically chaotic faminestricken society sought liberate due lack collaboration restore hope failed promote security economically essential gulf aden fedirka prevent spread cholera guerilla warfare food shortages hogg horn africa results demonstrate paramount importance interagency cooperation future american military endeavors casus belli american deployment isthmus panama primarily connected geopolitical position nation home panama canal notorious choke point international shipping routes grant 39 staging ground plethora drug cartels war drugs narcotics control efforts panama panama considered important ally us capacity threaten us national economic security thus foreign service judicial personnel began realize noriegas alternative allegiances hersh intervention deemed necessity successes operation cause toppling noriega regime eventually restoring panamanian sovereignty prosperity entirely based cooperation diplomatic military actors invasion panama 27000 american forces archibold us diplomats met opposition leader guillermo endara affiliates discuss political transition nation despotic militaristic regime noriega peaceful democracy diplomatic connection helped ensure immediate coordinated reconstruction effort invasion following apprehension noriega operation nifty package roughly 10000 american soldiers kane remained region act interim police forces cole usaid coordinated 500 million approved us department state fund infrastructural development reconstruction civil service history usaid panama combination release panamanian assets formerly frozen us treasury distribution withheld payments panama canal millett 7 immediately helped alleviate economic stress resulting corrupt practices regime cooperation actors department defense developmental organizations united states helped legitimize administration endara promoting economic recovery without threats national sovereignty cohesion efforts ensured power vacuum emerged wake event due lack cohesion notorious american invasion somalia disastrous effects society sought improve spurred unclear direction matthews international organizations security council resolution 794 granting secretarygeneral discretion employment personnel united nations operation somalia personal request un secretarygeneral boutros boutrosghali matthews operation restore hope failed lack reliance diplomatic actors necessary reconstruction intervention first mistakes lack understanding nonstate actors driving somali civil war due overzealous expectations department defenses ability swiftly carry military operations almost preventative diplomatic dialogue undertaken somali warlords beforehand restoring hope real lessons somalia future intervention apparent lack preliminary research state usaid officials us lacked important understanding nations fragile political fabric clear enemy even established combination black hawk incident killed 18 americans bowden factors turned military operation public relations disaster facing mounting political pressure clinton administration immediately ordered withdrawal nearly american military presence october 1993 address nation somalia incomplete nature military operation tandem insufficient interagency dialogue exacerbated challenges facing nongovernmental organizations ngos foreign service actors responsible rebuilding still fractured somali state response clintons orders defense department officials immediately began disarm somali security personnel protecting ngo foreign service employees taw 23 responsible forging centralized government growing economy still faminestricken politically fractured nation combination inherent safety hazards associated travel mogadishu 13 created debilitating staffing shortages undermined ability usaid private humanitarian relief funds promote reconstruction development 11 forcing military personnel take roles usually filled civil service members allard 21 duplication effort endangered american citizens undermining process development 2019 somalia nation plagued curable epidemics devoid centralized governance threatened transnational terrorist networks isis alshabaab somalia piracy ports refugees displaced conflicts endangered essential international shipping routes fedirka strained social security nets neighboring countries crisis increasingly danger global economic political security considering somalias struggles impossible question could panama interagency cooperation military actors foreign agency officials usaid yielded situation far improved corrupt undemocratic farnsworth economically backward regime manuel noriega similar strategies restore hope could yielded far improved result,0,15.72251343881736,0.36885245901639346,5.959016393442623,0.10860655737704918
standing human rights china presents formidable challenge american foreign service given countrys complex political landscape history human rights abuses despite numerous challenges crucial foreign service remain steadfast commitment promoting protecting human rights china heres expanded exploration challenges strategies involved 1 systemic human rights violations chinas human rights violations encompass wide range issues including political repression censorship religious persecution discrimination ethnic minorities violations deeply entrenched within chinas legal political system making challenging address example case hu jia prominent human rights activist illustrates governments use arbitrary detention politically motivated charges silence dissenting voices address violations foreign service must engage frank constructive dialogue chinese officials advocating legal reforms protection fundamental freedoms accountability mechanisms hold perpetrators accountable human rights abuses 2 diplomatic engagement diplomatic engagement offers critical platform addressing human rights concerns china despite previous setbacks breakdown human rights dialogues recent indications chinas willingness resume discussions present opportunity renewed engagement foreign service must seize opportunity push concrete improvements areas judicial independence freedom expression protection minority rights fostering dialogue cooperation foreign service work towards enhancing respect human rights within chinas legal political framework 3 economic interdependence deepening economic ties united states china present opportunities challenges human rights advocacy economic cooperation provide leverage influencing chinese policies also raises concerns issues intellectual property rights trade imbalances foreign service collaboration foreign commercial service must leverage economic incentives encourage china adhere international human rights standards may involve advocating fair trade practices promoting corporate social responsibility supporting initiatives promote sustainable development equitable economic growth 4 international pressure international pressure including public advocacy diplomatic initiatives play significant role influencing chinas human rights practices calls boycott beijing olympics highlighted global concerns chinas human rights record spurred international debate however decision reject boycott reflects nuanced understanding diplomatic strategy instead isolation foreign service advocates engagement dialogue means effecting positive change working collaboratively likeminded nations international organizations foreign service amplify efforts increase pressure china address human rights issues 5 longterm commitment achieving meaningful progress human rights china requires sustained longterm commitment foreign service events like olympics may raise awareness addressing deeprooted issues promoting systemic change requires patience perseverance secretary state condoleezza rice aptly noted change may take time change come foreign service remains dedicated advancing human rights principles china recognizing progress requires sustained efforts across multiple fronts staying engaged advocating reform supporting civil society initiatives foreign service contribute future rights freedoms individuals china respected protected many human rights violations china deeply ingrained within countrys legal political societal structures example suppression dissent censorship restrictions freedom expression systematically enforced laws regulations effect meaningful change essential address underlying root causes sustained advocacy legal reforms institutional changes requires longterm commitment engaging chinese authorities civil society organizations international partners push systemic reforms uphold human rights principles longterm engagement fosters trust credibility essential effective diplomacy maintaining consistent dialogue cooperation chinese counterparts american foreign service build relationships based mutual respect understanding time relationships become conduits constructive engagement collaboration human rights issues building trust also opens avenues confidential discussions allowing frank exchanges exploration sensitive topics civil society plays vital role promoting human rights democratic values china however civil society organizations often face repression harassment restrictions activities american foreign service support empower civil society actors longterm initiatives provide funding capacitybuilding support advocacy assistance investing resilience sustainability civil society foreign service contributes development vibrant independent advocacy network push change within chinese society conclusion standing human rights china formidable essential task american foreign service navigating complexities diplomatic engagement economic interdependence international pressure foreign service remains committed promoting human rights fostering positive change china sustained efforts unwavering dedication foreign service continues advocate future rights freedoms individuals china respected protected addressing challenges diplomatic engagement economic cooperation international pressure longterm commitment foreign service work towards promoting positive change advancing human rights principles china,1,8.416673485527609,0.3237885462555066,6.314977973568282,0.14757709251101322
day tooth fell mouth clarity cloudless sky forced face truth festering beneath surface like others came unexpectedly sudden lump throat feared might sickness instead bore physical emblem strangeness—a sharp yellowed tooth starkly alien backdrop otherwise pristine smile unsettling discovery feeling coursed one revulsion dark enigmatic excitement sharp tooth harbinger change visceral symbol strangeness taken root within bones conspiring rewrite identity small golden dagger tooth relic reality yet understand sparked morbid curiosity potential fantastic grotesque lay dormant within flesh bethanys judgement bethanys voice sliced reverie precision scalpel—judgmental sharp tinge fascinated horror eyes saw reflection every sneer every whispered slur learned fear since childhood way leaned eyes narrowing mouth slightly ajar inquisitor executioner ready deliver verdict upon oddity disposal evidence moment panic discarded tooth among refuse halfeaten lunches crumpled homework smothered flicker intrigue tooth kindled within dissonance bodys rebellion need maintain facade normalcy jarring magician skeptical audience unsure whether trust trick unfolded eyes second sign scales emergence gentler less jarring luminescent patch skin caught light held transforming wrist canvas iridescence personal mosaic testament transformation couldnt halt hide mothers reaction cold gust warmth discovery eyes turned ice silence heard echo every prayer shed whispered normalcy confession confinement confession ritual emptiness small dark booth prison piety meant atone sins could comprehend whispered empty words father john man whose life woven fabric mine yet seemed distant star words meant comforting tightened knot guilt settled pit stomach shadow shame knew shame far intimately knew love constant companion shadow stretched back earliest memories deprivation food punishment tears tasted salt bitterness isolation dining room stool—these foundations upon understanding self built cost conformity adherence unwritten rules armor mastered art invisibility ensuring voice never rose murmur appearance never strayed path conservative acceptance skirts brushed knees barrier world demarcation line screamed belong secret unfurls wing unfurled hidden fragment essence taking physical form felt unfamiliar surge pride piece night soft delicate yet undeniably potent confines classroom become small expanding sense self dared acknowledge stroke gently recognize part violent rejection home became site violation father man order precision reacted wonder revulsion extracted wing gardeners indifference removing unwanted weed pristine garden hands source security wielded pain certainty surgeons scalpel fathers unforgiving love silence followed pregnant unasked questions unspoken accusations mother silent witness parted lips chasm complicity concern offered solace air thick coppery scent blood tangible reminder cost deviance aftermath left room dignity understanding quiet resignation misunderstood throbbing wound back testament fathers love—a love demanded uniformity saw aberration flaw corrected blemish facade familial perfection reflections dark lying awake bandages rough skin pondered nature fathers lessons cycle destined repeat inheritance intolerance passed like treasured heirloom would find scrutinizing future critical eye demanding conformity freedom recognition kindred spirit jude beacon audacious authenticity sea sameness horns worn proudly like diadem challenged narrative fed saw alternate path possibility embracing peculiarities taught fear suppress allure difference judes horns far mark grotesque regal defied conventional definitions beauty demanding attention respect presence found questioning foundations judgments internalized possible made us different also made us extraordinary bethanys scorn power acceptance bethanys derision source anxiety seemed inconsequential judes unflinching acceptance unique attributes illuminated hollowness scorn realization bloomed slowly within me—a recognition perhaps freakishness others feared fact form magic,1,7.8161299717626465,0.4831243972999036,4.8659594985535195,0.06750241080038573
examining aftermath iraqkuwait conflict becomes evident failure preventive diplomacy avert armed conflict resulted profound humanitarian environmental consequences conflict marked iraqs aggressive invasion occupation kuwait unleashed wave violence human rights abuses civilians bearing brunt brutality reports atrocities including widespread killings torture sexual violence perpetrated iraqi forces kuwaiti civilians shocked international community underscored urgent need intervention halt bloodshed despite diplomatic efforts aimed resolving crisis dialogue negotiation iraqs refusal withdraw kuwait belligerent rhetoric escalated tensions region imposition economic sanctions united nations security council aimed exert pressure iraq comply international law withdraw forces kuwait however measures proved insufficient deterring iraqi aggression highlighting limitations coercive diplomacy addressing entrenched conflicts authoritarian regimes conflict escalated humanitarian toll grew increasingly dire civilians facing indiscriminate violence displacement deprivation united nations estimates hundreds thousands kuwaiti citizens forcibly displaced homes seeking refuge neighboring countries living precarious conditions within kuwait moreover prolonged conflict exacerbated existing humanitarian crises shortages food water medical supplies exacerbating suffering vulnerable populations including women children elderly furthermore environmental impact iraqkuwait conflict profound farreaching longterm consequences regions ecosystems public health deliberate destruction kuwaiti oil wells retreating iraqi forces led largest manmade environmental disaster history vast quantities oil spewing persian gulf contaminating marine habitats coastal areas environmental devastation caused oil fires coupled release toxic pollutants hazardous chemicals posed grave risks human health biodiversity longlasting effects local ecosystems livelihoods gulf war syndrome complex medical condition affecting veterans civilians exposed environmental hazards conflict remains stark reminder human cost war lasting legacy environmental contamination symptoms gulf war syndrome include chronic fatigue respiratory problems neurological disorders reproductive health issues thousands individuals experiencing debilitating health effects years conflict ended failure adequately address health needs affected populations underscores urgent need comprehensive strategies mitigate longterm health consequences armed conflict environmental degradation aftermath iraqkuwait conflict imperative preventive diplomacy conflict resolution never clearer failure prevent armed conflict resulted immense human suffering loss life also inflicted lasting damage environment public health international community grapples new emerging threats peace security including regional conflicts terrorism nuclear proliferation lessons learned past failures underscore need proactive diplomacy multilateral cooperation concerted efforts address root causes conflicts promote sustainable peace stability delve deeper ramifications iraqkuwait conflict essential explore multifaceted impact conflict different sectors society including economy infrastructure social fabric affected regions economic consequences conflict significant iraq kuwait suffering extensive damage infrastructure productive capacities destruction oil wells refineries kuwait coupled disruption oil production exports dealt severe blow regions economy leading widespread unemployment poverty economic hardship moreover protracted nature conflict ensuing humanitarian crisis exacerbated existing social tensions divisions deepening ethnic religious sectarian rifts within society displacement populations breakdown social networks erosion trust communities undermined social cohesion stability creating fertile ground resurgence violence conflict postwar period rebuilding trust fostering reconciliation among diverse ethnic religious groups emerged formidable challenges aftermath conflict requiring sustained efforts address grievances promote dialogue build inclusive institutions respect rights dignity citizens furthermore environmental degradation caused iraqkuwait conflict farreaching consequences health wellbeing local populations well broader ecosystem persian gulf region extensive oil spills fires polluted marine habitats coastal areas also contaminated groundwater sources jeopardizing access safe drinking water posing longterm risks public health release toxic pollutants hazardous chemicals environment posed additional challenges exacerbating already precarious living conditions vulnerable populations undermining efforts promote sustainable development environmental conservation region addition immediate humanitarian environmental impact iraqkuwait conflict longterm geopolitical implications reshaping balance power middle east influencing regional dynamics decades come deployment international military forces led united states allies expel iraqi forces kuwait underscored importance collective security multilateral cooperation addressing transnational threats preserving global peace stability however legacy conflict continues reverberate throughout region fueling geopolitical tensions sectarian strife political instability countries affected aftermath conflict,1,7.473211417382014,0.3599137931034483,6.2467672413793105,0.14547413793103448
