text,label,sentence_variation,%stop_word_total,mean_word_length,%adjectives_total
standing human rights challenges facing foreign service china july 20 2005 lin hongying 56yearold woman farmer beaten death police jiangsu biao jia 2 april 3 2008 hu jia human rights activist fought justice china sentenced three half years prison falsified charges inciting subversion state power casey march 1415 2008 unrest tibet violent crackdown police sparks international protests examples black marks chinas human rights record reason china greatest challenge facing foreign service 21st century countdown 2008 beijing olympics chinas record denying citizens basic rights life liberty property despite guarantees articles 3341 chinas constitution gained worldwide awareness example march tibetan leaders estimated 140 tibetans dead hundreds thousands others wounded detained facing starvation aftermath began peaceful demonstration chinas censorship journalists citizens makes assessing actual damage nearly impossible shrestha order clean streets china olympics police sent many human rights activists impoverished chinese governmental dissidents prisons labor camps 2007 estimated 125 million people houses forcibly demolished without compensation order make way olympic construction biao jia 2 china also consistently enforced onechild rule forcing women one child undergo abortion china country reports chinas longstanding history human rights abuses sparked protests activists along route olympic torch london paris san francisco us foreign service world leader democracy individual rights faces multidimensional challenges effort improve human rights china us attempted resolve human rights issue diplomatically since 2004 talks broken 12 rounds unproductive dialogue however china recently announced ready resume human rights dialogue rice chinese fm talks scheduled spring 2008 order resolve problem ambassador randt president bush commercial officer officials us embassy beijing must unite collateral effort promote strong us presence china engaging diplomatic talks human rights ambassador must represent promote us foreign policy chinese government influence china make right choices dorman 1011 chinas recent collaboration un end violence darfur demonstrates consistent pressure us diplomats succeeding christensen send strong international message chinas human rights record many protestors demanded president bush boycott olympics refrain attending opening ceremonies june 2007 statement state department rejected option olympic boycott basis would cause bitterness among chinese people destroy progress already made us diplomats towards resuming talks human rights deprive american athletes chance gold medal green china already accused us clinging cold war mentality labbott florcruz boycott would confirm false assumption reflecting 1980 us boycott moscow olympics according president bush upcoming olympics moment chinas leaders … show confidence demonstrating commitment greater openness tolerance chinese society green instead boycott foreign service use olympics opportunity urge china closer free society emphasizing benefits respecting human rights united states china becoming increasingly economically interdependent relationship one critical complex world past five years us exports china increased 18 52 billion us imports china grown 102 287 billion remarks relationship complicated united states 2325 billion bilateral trade deficit us house commercial officer entire foreign commercial service fcs play important role maintaining healthy economic relationship encouraging american companies sell china increasing us exports dorman 2223 fcs must urge china respect intellectual property rights crack rampant piracy cost us companies 25 billion dollars lost sales congressional research service reducing us trade deficit decrease economic dependence china gain leverage promote human rights values improving human rights china beneficial chinese people united states encouraging chinas stability economic growth china gain respect international community loyalty people president bush noted meeting legitimate demands citizens freedom openness chinas leaders help country grow modern prosperous confident nation us sees progress change kind requires time although olympics raised international awareness chinas human rights situation alone enough fully resolve issue persistent diplomacy 21st century members us foreign service continue progress toward day chinese people free governmental repression secretary state condoleezza rice declared corner earth permanently condemned tyranny change may take time change come,0,13.836479438979634,0.3697916666666667,5.377083333333333,0.103125
first spit tooth lunch one cloudless day im getting ready go class lump risen throat blistering sudden panickedly thought going puke first thing notice mine teeth straight white come chest tooth though yellowing sharp enough cut remember disgust feeling darker excitement curls deep gut looks like tiny golden dagger something inexplicably fascinating thought strangeness resting skin waiting called forward friend bethany asks tone bites gaze tilting predator ready pounce pleated skirt headband fear seizes tell nothing throw pretty thing nearest trash disappears sea halfeaten apples empty milk cartons scale comes next nudges way skin shines wrist looking like beautiful intricate tattoo mother sees eyes go cold ushers confession didnt anything wrong plead confessional wall still compelled hang head hair falls face lace hands together knuckles bloodless bones jutting utterly devout known father john long time attended baptism first communion grandfathers funeral aunts wedding mere thought torpid unchanging eyes suffocates wooden surroundings ever could one without sin says unkindly wonder hes right guilt darkens chest human birthright sin —could really sin—that marks body legacy learned shame love earliest memory made sit stool dining room allowed dinner punishment something id done dont remember remember tears burning cheeks like fire skin wondering parents would forget wondering would stay portrait pigtails despair rest life since done best avoid punishment speak need classes keep hair straight nails tidy clothes modest skirts never cutting knee keep noticing wing sprouts back middle math test glance around see anyone noticed tent shirt dont pick anyone looking back smooth hand soft warm feels like belongs bat almost proud arrive home school father rips back way pulls weeds backyard thick fingers steady hand fisted always hated imperfection gardens daughters wing flutters weakly first touches resistant try move away deter pain like nothing ive felt overtaking senses seconds scream scream scream yells stop tells grateful fixed saying fault desperately tug memories happy loving find looking stranger afterward apologize mouth set mother watches lips parted wish would soften come terms selfrighteousness sown planted feet hard eyes bear scars wings clipped toostrange limbs amputated look husband still breathing mouth heaving ache attack yet subsided quiet kind terror filling realize moisture sticking clothes skin isnt sweat redhot blood look fathers face tells leave dont say anything go tell thing learned father grandfather thing never unlearned thing cannot teach look past ideals see loosen jaw ungrind teeth doubt loves bleeding starts near midnight venture bathroom rebandage wound doubt understands looking dark circles like spilled ink wonder understand either another impossible thing girl english class like name jude doubt remembers name weve spoken times instances didnt discern desire converse dont blame bursts answers class passion cant help believe even words spill mouth scrambled enthusiasm wears bold eyemakeup leaves freckles showing tips hair dyed atop head two beige horns theyre symmetrical unmistakable wears like another arresting accessory behold think look like crown bethany others call freak,0,8.86630541654969,0.48697394789579157,4.302605210420841,0.08016032064128256
little late often prevention violent conflicts holds true peck roots problem identified time violence becomes solution preventive diplomacy one way avoiding conflicts defined action prevent disputes arising among parties prevent existing disputes escalating conflicts limit spread latter occur boutrosghali 45 preventive diplomacy protects peace ultimately people suffer greatly armed conflicts preventive diplomacy used many disputes including border dispute venezuela great britain 1890s decades iraqkuwait dispute conflict prevented venezuela however preventive action effective kuwait civilians suffered result united states intervention border dispute venezuela one example preventive diplomacy unfortunately border guyana venezuela never clearly defined colonial maps inaccurate lombardi 29 1840s 1880s britain pushed venezuela guyanas western border claiming areas gold lombardi 29 asserting land río essequibo orinoco part guyana schomburgk line according colonial maps daly 2 britain vehement right land venezuela appealed us aid monroe doctrine us states act police force protect latin america european influence us viewed britains occupation portion venezuela breech doctrine cleveland 93 conflict imminent britain began prepare navy war boutwell 4 solution appeared 1895 person secretary state richard olney enthusiastic attempt preventive diplomacy olney sent dispatch britain stressing importance monroe doctrine lord salisbury britain responded saying monroe doctrine applicable venezuela situation system government forced upon country cleveland 100101 addition salisbury pointed conflict result acquisition new territory guyana owned territory question boutwell 10 olney stressed issue pertinent american stability remained steadfast demands cleveland 109 britain refused submit congress authorized presidents appointment investigative committee meanwhile salisbury olney organized meeting november 10 1896 meeting treaty written us threatened use military remove britain venezuelas border necessary britain venezuela signed treaty february 2 1897 giving venezuela control río orinocco much land behind schomburgk line cleveland 117118 thus preventive diplomacy part us successful war avoided use preventive diplomacy recent iraqkuwait dispute less successful iraq part ottoman empire 1700s 1899 britain granted autonomy darwish alexander 6 1961 britain gave kuwait independence iraq claimed historically kuwait part iraq sasson 9 iraq begrudgingly recognized kuwaits independence 1963 awhile relations two countries improved kuwait aided iraq monetarily iraniraq war 1980 1988 sasson 11 war however iraq demanded money kuwait reconstruction iraq accused kuwait drilling oil border without sharing taking oil organization petroleum exporting countries opec quota permitted sasson 12 iraq began threaten kuwaiti borders beginning conflict would take thousands soldiers away homes harm civilians detrimentally affect environment 1990 iraq began mobilize near kuwait border darwish alexander 6 arab nations made unsuccessful attempts preventive diplomacy us news world report 99 surrounding nations attempted unsuccessfully meet saddam hussein iraq invaded kuwait took control capital august 2 1990 installed puppet government husseins command iraqi soldiers brutally raped kuwaiti women killed civilian considered obstruction sasson 76 point united nations security council arab league placed embargo iraqi oil punishment iraq response annexed kuwait us news world report 9596 war imminent november 29 1990 iraq showed signs would retreat united nations security council declared coalition use means expel iraq kuwait iraq remained january 15 1991 gordon trainor 195 final attempt preventive diplomacy january 9 james baker us met iraqs foreign minister tariq aziz baker stressed coalition willing fight encouraged iraq leave kuwait us news world report 199 iraq however refused retreat hussein declared iraq would fight holy war kuwait world realized war means solving problem gordon trainor 197198 air assaults began january 17 land war began february 24 us news world report iraqi civilian casualties heavy land war lasted 100 hours numerous oil wells set afire causing emission dangerous gases peace never truly made hussein resisted requirements peace including frequent united nations inspections prohibition possession nuclear weapons us news world report 447 consequences iraqkuwait conflict grave civilians iraq kuwait suffered fires oil wells caused dangerous air pollution american soldiers suffer socalled gulf war syndrome caused number afflictions death syndrome believed resulted biological chemical weapons gases emitted oil,0,9.916488022171839,0.3567073170731707,5.352642276422764,0.06605691056910569
rich countries meaningfully help developing countries improve standards living according neoclassical economic theory developing countries would experience economic growth time accompanied improvement standards living healthcare education reality many developing countries stuck underdevelopment considerable period time despite continuous intervention rich countries moreover even questioned effectiveness current form foreign assistance evaluating current forms intervention sending foreign aid encouraging trade openness argue interventions ineffective hampered institutions developing countries theoretically rich countries use foreign policy influence institutions developing countries ensure corrupt free government improving aid effectiveness fairer trade agreements would also lead improved standards living however difficult see rich countries willing install changes given benefits gain current ineffective interventions intervention rich countries developing countries may achieved desirable effects often limited economic political institutional settings developing countries instance developing countries undesirable economic institutions lack property rights would deter firms landowners investing protection unstable legal system hand prevalence dictatorship undesirable political institution encourages monopolistic activity rent extraction lead inefficient distribution resources ultimately poor economic political institutions deter citizens engaging entrepreneurship economic transactions leading persistent low income standards living poor institutions lead poverty traps also hamper effectiveness foreign intervention rich countries one prominent example aid conventionally aid distributed via government acts intermediary allocates resources local communities however corrupt governments aid highly likely embezzled government officials rather improve infrastructure living health conditions promotes development essence foreign aid props corrupt government providing freely usable cash according transparency international mobutu estimated looted zaire known democratic republic congo us 5 billion amount president sani abacha looted nigeria poverty underdevelopment cannot solved aid channelled elites instead promoting development providing public services crucial note institutions blame entirety foreign intervention ineffectiveness aid existing form limiting effectiveness although foreign aid often conditional general formbased targets structural improvement fact targets open interpretation limit effectiveness countries heavily dependent aid could meet conditions simply selecting easy targets within formbased targets limited value institutions organised rather effects policies government pursue since recipient countries rewarded achieving easy formbased targets incentive select difficult targets substantially improve standards living moreover unlikely main purpose aid used improve standards living developing countries foreign aid tied conditions enhance economic interests donor countrys multinational corporations requiring recipient country purchase equipment arms materials recent research griffiths 2014 demonstrates financial outflows spending donors exports interest paid developing countries average double inflows aid foreign direct investments country suggests aid unlikely remain recipient country long instead similar subsidy donor countrys domestic producers another channel foreign intervention trade liberalisation conventionally countries tried improve living standards developing countries imposing structural adjustment programmes world bank however periphery developing countries failed benefit programmes worsened standards living 1970s 10 africans lived poverty risen 70 goods exported periphery developing countries generally lowvalue added lowincome elasticity whereas goods exported core rich countries generally highvalue added highincome elasticity disposable income rises demand highvalue added goods increase faster lowvalue added goods due disparity income elasticity value added exports increase demand highvalue added goods naturally raise prices hence prices lowvalue added goods fall relatively means periphery give exports receive amount imports core meaning terms trade fall time core becomes better fall terms trade lead fall standards living purchasing power decreases analysis illustrates intervention rich countries meaningful must first target institutional changes developing countries regard richer countries engage meaningful intervention leveraging economic power exert diplomatic pressure introduce changes changes guaranteeing property rights allow citizens convert land collateral borrow invest start businesses creates multiplier effect employment raises standards living time changes institutions would associated efficient distribution economic resource inclusive economic institutions brought foreign pressure influence resourcerich developing countries sell rights resource extraction private enterprises would raise government revenue used infrastructural welfare improvement resource extraction also likely efficient private enterprises without dependence resource revenues governments increase dependence taxation ties citizens demands closely governments actions ultimate benefits would firstorder secondorder involving improvement public services help lift living standards well increased employment boosts individual income material wellbeing,0,8.411985062918031,0.40245051837888784,5.839773798303487,0.13289349670122527
human rights universal western construct crucial document passes 80 votes favor one would expect debates validity nonexistent least abate soon approval yet comes universal declaration human rights udhr debate still continues today 70 years later whether considered truly universal existing debate based variety factors arguments made saying concepts document entirely westernized well saying unequivocally universal nature debate brings question whether anything multicultural world considered truly universal answer essay focus aspect individualism versus collectivism analyze nature document question filter prior focusing individualist versus collectivist aspects document important understand arguments made nature asserted certain degree confidence continuous indication western bias throughout udhr namely focus rights divorced ones moral obligations greater priority placed civil political rights conceptions human rights asian islamic put greater emphasis economic social cultural rights illustrating udhr said focus mostly western priorities needs furthermore various nonwestern societies shown lack mere concept human rights stated declaration example practice female circumcision african countries spite considered completely violate abundance human rights practice seen fundamental requirement marriage well constituent womens roles society various african cultures fact consensus udhr differs extent african societies many continents leaders adopted african banjul charter human rights believe significantly suitable society last argument made towards universal declaration human rights depicts ideas based historical experiences western countries therefore seen succeed places similar values histories well possess significant amount money resources used implement mandated rights overall therefore clear argument basis udhr fundamentally western therefore aggregates values western society significantly comfortable differently say rights present universal declaration human rights purely western disregard variety values present around world nonwestern societies first example right equality law without discrimination seen present variety sets values illustrated anwar ibrahim advocate asian islamic values said say freedom western… offend traditions well forefathers gave lives struggle tyranny injustice one example right corresponds values present cultures right life present quran considers human life divine bestowal humanity secured means similarly right privacy recognized verse 2427 muslim holy book furthermore jack donnelly author universal human rights theory practice suggested simply idea emerged one place mean cannot applied second debunks idea udhr seen work western world respects also known drafters declaration invent ideas present simply put words idea shared prior end war abundance envisioners new world order therefore said many rights present universal declaration found combination western nonwestern cultures however seem completely disprove argument majority rights made way mostly applicable western society order truly come conclusion universality udhr necessary evaluate individualist versus collectivist perspective significant proof preponderance rights present declaration given individuals extracted communities belong seen fact majority articles state positive items begin everyone fundamentally means every individual state negative ideas begin one single individual deliberate choice words clearly shows nature udhr fundamentally individualistic furthermore writing article 29 declaration inclusion phrase alone full free development personality possible suggested passed vote 23 5 shows majority delegates present drafting resolution believed necessary make clear rights declaration given human beings individuals illustrated use word alone critics spoken wording article stated suggests humans egocentric closely tied communities idea completely goes beliefs collectivist cultures,0,17.593590843699594,0.49497991967871485,4.988955823293173,0.09236947791164658
