text,label,sentence_variation,%stop_word_total,mean_word_length,%adjectives_total
filling afghan security gap womens education means weakening taliban world cannot achieve sustainable peaceful prosperous future without investing girls education wrote malala yousafzai student girls education activist xvii households depend women especially men left home fight expanding girls education thus maximizing womens economic potential directly contributes familys prosperity sloan therefore country like afghanistan militant islamic taliban preys poverty recruitment womens education crucial building peace since mission bureau us agency international development bureau democracy conflict humanitarian assistance usaid dcha end extreme poverty promote resilient democratic societies take charge expanding womens education spur development however recognize talibans attacks girls schools constrain womens educational opportunities thus chief strategy disseminate educational technologies—rather solely build schools—so women flexibly adapt educational schedules regional conditions taliban threat afghan population remains critical first half 2015 taliban forces caused deaths 4300 afghan security personnel wounded 8000 addition causing 1592 civilian casualties 3329 injuries additionally taliban violence directly harms us interests expansion power could result creation safe harbor antidemocratic terrorists council foreign relations thus moral pragmatic duty promote afghan peace weakening taliban build sustainable peace must address symptoms conflict must eliminate source talibans power foreign policy consultant benedetta berti brought light fact citizens afghanistan experiencing security gap—a lack employment income financial stability—that taliban preys words young taliban recruit today afghanistan finding job easy thing want join taliban make income earn living qtd robertson plan promote girls education critical filling security gap families depend womens support women mothers incomeearners small business owners goal make professionals educating women bolster household prosperity thus reversing leverage taliban holds recruitment multiple studies confirm increase womens educational opportunities leads increase income world bank girls education generally women higher incomes spend families study conducted throughout colombia bosnia herzegovina timor leste kosovo tajikistan reveals acrosstheboard increase household welfare women employed wellpaid justino cardona mitchell müller goetz beteta dore study bangladeshi microcredit programs reports household consumption proportionally sixtyfour percent higher women participants men pitt khandker 958 additionally women higher incomes likely invest childrens education—turning cycle poverty cycle development world bank world development report 2012 151 household welfare increases families rise poverty members less likely resort joining taliban support financially promoting female education clearly help fill security gap afghanistan ergo draining taliban recruitment power however local cultural bias obstructs womens empowerment sloan notably small minorities violent extremists—such taliban—pose dangerous security concern attacking girls schools potentially render schoolbuilding impossible kuehnast omar steiner sultan 5 mortensen relin 208 2012 alone security threats caused almost ten percent schools afghanistan—which provided education 275000 students—to shut threats disproportionately target women thus greatly deterring girls pursuing education evidence girls fear every 100 boys seventy fiftyfive girls attend primary secondary school respectively batha surmount security concerns plan disseminate online educational resources rather physically build schools instead letting taliban target class— meets predictable place time—a flexible system online schooling allow women adjust conceal educational agendas based local conditions addition interconnected online network among women facilitate reporting security threats thus enabling national security forces respond quickly since state departments bureau economic business affairs eb mission promote economic security prosperity home abroad closely intertwined goal eb principal partner project us department state first step ebs office international communications information policy ebcip aid world bank providing additional funding fiber optic cable project afghanistan thus accelerating rate internet broadband expansion united nations economic social commission asia pacific 25 next online communication network prowomen local civil society organizations csos office usaiddcha office conflict management mitigation collect analyze data womens socioeconomic conditions throughout country economic officer subject matter expertise economic investment education dorman 21617 thus analyze regional security risks potential economic gains create individualized plans disseminating educational resources involve minimal safety concerns low riskbenefit ratio,0,13.606520848436903,0.3391304347826087,5.859782608695652,0.1108695652173913
awakening witness empowering engagement leveraging new media human connections new technology engineer positive change peace defined inclusivity representation cooperation respect built human connections new mediai revolutionary ability forge connections allowing individuals across strata society spread messages become participating members digital communityii recognizing potential spurring political social change civil society organizations harnessed new media reach formerly excluded underserved communities campaigns targeting issues ranging development health violenceiii equally important new media provide platform ordinary citizens create new movements movements successfully translate digital momentum realworld action new media genuinely catalyze peace twitter revolutions last years sparked debate extent new media alter dynamics change iv new media create space sharing independent information voicing dissent lower entry costs participation however new media also used monitor persecute activists disseminate messages hatev solution conflict facilitate cooperation expand participation new media best leveraged peace empower ordinary individuals might otherwise excluded silenced reduced condition bystander participate dialogue action affirms dignity voice potential well new medias risks limitations seen two case studies events leading fall mubarak regime egypt 2011 postelection crisis kenya 2008 january 2011 millions egyptians protested president hosnei mubaraks long history civil human rights abuses ousting strongmans 30yearold regime three weeks new media played significant role priming egyptian society revolution prior revolution mubarak regime heavily censored traditional media internet ali 204 megenta 49 result egyptian youth urbanites established movements opposition parties went online disseminate independent information engage debate organizevi several bloggers gained national international prominence offline allowing publicize human rights issues mainstream establishment previously suppressed vii activists also used facebook new media sites rally young people around human rights justice causes two organizations lent crucial momentum january 2011 revolution april 6 th youth movement khaled said began facebook campaigns whose pages documented abuses connected followers important newsviii page 2 20 20112012 national peace essay contest effect technology acted magnet activists creating alternative sort civil society meier 172 successful revolution tunisia inspired egyptian community activists coalesced new media launch revolution 85000 egyptians pledged facebook attend revolution day ali 185 activists set january 25th day protest moved cyberspace tahrir square hundreds thousands egyptians poured streets images violence went viral mubarak regime shut internet restricted mobile phone service cowie momentum continued grow leadership online movements joined opposition political groups using traditional organizing tactics including megaphones posters leaflets dreyfuss mass protests continued early february february 11th mubarak resigned egypt new media empowered citizens express dissent gave birth community citizenactivists led change transformed thousands frustrated suppressed egyptian youth engaged citizens new media fostered culture activism shared grievances became legitimized grievances political dialogue helped give rise expectation fair society facilitated solidarity across different strata societyix created cadre digital activists also spearheaded realworld campaignsx new media however cause egypts revolution spur citizens onto streets lot people never touched keyboards lives came protest nadine wahab administrator khaled said facebook page cited sutter new media greatest effect peace access must spread beyond urban elite populations online activism must paired real world organizingxi nothing circumvent need serious work ground shape egypts future towards peace mere involvement new media precipitating change ensure particular political outcome new media foster broaden empower movement egypt movement must translate energy ongoing political social action kenya disputed elections december 2007 triggered threemonth crisis new media used promote prevent violence hours kikuyu president mwai kibaki claimed victory election coverage shown luo opponent raila odinga leading million votes goldstein 4 ethnic violence exploded response apparent fraud textmessages inciting ethnic violence circulatedxii kenyas popular online messageboard mashada overrun hate speech administrators took site offlinexiii violent mobs luo kikuyu men boys organized often paid local political tribal leadersxiv gangs organized new media many formed community meetings rawlence 45 response violence online community peacebuilders mobilized spread messages humanity peacexv significant innovation creation online map documenting instances violence based citizen reportsxvi page 3 20 20112012 national peace essay contest platform ushahidi accepted reports via email twitter online form text message allowing kenyan access mobile phonexvii share experience xviii 1100 deaths 300000 displacements simons crisis ended april formation unity government including kibaki odingas parties kenya new media purveyed messages violence also spread messages peace,0,11.33765085212656,0.3378509196515005,5.65053242981607,0.12584704743465633
contemporary art social value social value indication impact particular aspect human welfare whereas seemingly contrasting light often associate contemporary art sense freedom something unexpected – standing outside realm rigid instrumentality essay aims illustrate intersection two sitespecific installation suspended arabella dorman currently canterbury cathedral les colombes michael pendry currently salisbury cathedral pieces address significance subjectmatter situation site consequently discuss wider implication contemporary artworks society subject matter pieces developed give voice groups contrast expressing individual style allows subject preliminary focus installation artists adapt role impartial presenter – introducing subject space suspended les colombes installed nave cathedral enhanced bodily presence individuals objects first glance artworks incorporate contrast texture stone masonry cathedral interior immediately attracts attention audiences invited form emotional connections exhibited objects taking closer look particular elements draws details grand cluster objects instances function powerful narratives whilst leaving space imagination suspended object voices uncertainty refugee crisis figure 1 illustrates one instance – viewers invited contemplate situation previous owner clothing worn toddler cannot see represented clothes unable know exact identity sympathise gone pursuing safer life impression first christmas may blurred way memory difficulties journey become dusty time settles yet future immediately visible undefined anxious anticipation refugee camps particular instance entails state suspended – stuck past cannot return future cannot move forward concept reinforced display clothing paused suspension prevented returning top landing onto floor sense despair vulnerability refugees reflected softness fabrics power decide next step wait hardship comprehended looking clothes represents belonging refugees forced abandon even cannot contact refugee directly looking dormans installation empathy evoked refugees european island indirect presence represented suspended clothes similar connection made les colombes doves visualise universal appeal peace grouping individual components original 2500 origami doves current display joined new ones created individuals community installation exhibited different locations figure 2 includes detail one particular dove among many others though cannot read written wishes entity perhaps guess contributors intention parallel drawn use visual form universal way communicative beyond language doves materialise shared hope effectively sentences languages detail see variety hope entailed writing – dove examined closely uniformity among wishes peace – situated flock viewing afar individual object resonates meaning central composition aspiration fundamental human right – right peace freedom entity – lies symbolism dove particulars – prayers longings various communities coexist harmony transmit message peace salisbury cathedral despite indicator relation individual community installation also functions reminder preceding recent historical events salisbury community experienced initial narrative retrospective 1918 – commemorating centenary end world war one another layer meaning added recent nerve agent attack former russian spy sergei skripal two months ago town installation embraces potentiality movement yet remains still signifying impact history salisbury community doves moving brandnew era towards ideal destination perpetual peace past always memorialised present alerting us future way doves carry written messages flock hence les colombes constantly reminds us importance conciliation coexistence tranquil presence cathedral situation works cathedral nave also complimentary sublime quality object resembles traditions visitors arriving cathedral purposefully suffice spiritual need remain unchanged time significance church space traced back medieval time memory reinforced sensations objects seen felt christians remember … places pilgrimage episodes life christ maintain concept practice – handling object devotional gesture divert tribute reverence sacred – attached role church shrine hosting relics religious icons role cathedral equally necessary installations hosting place guiding visitors contemplating social implication attached meaning behind objects,0,14.443867422627811,0.46543330087633883,5.129503407984421,0.08179162609542356
womanhood peacemaking taking advantage unity cultural roles successful gendered approach conflict resolution january 1998 50 women opposing sides bougainville conflict successfully presented female perspective negotiations lincoln agreement1 consistent participation women helped establish permanent peace collectively using roles society unified initiatives conversely cote divoire failed achieve resolution 2002 civil war2 though cote divoire struggled gendered approach peacemaking polarization around ethnicity perceived deviation cultural roles hindered effectiveness inclusion women peacemaking attempted bougainville conflict first ivorian civil war relative successes determined significantly degree unity gendered actions deference cultural norms two cases show gender inclusion contributes greatly peacemaking processes essential sustainable conflict resolution bougainville autonomous region papua new guinea completed weapons disposal program held transparent first election may 20053 finally stepping longterm stability 1989 1998 violent conflict sparked mining rights bougainville revolutionary army bra papua new guinea defense forces pngdf raged region leaving 15000 dead4 government crumbled conflict degenerated widespread guerrilla warfare localized violence running revenge traditional clan tensions5 males susceptible combatrelated afflictions playing active roles conflict women bougainville suffered longterm consequences conflict expected continue raising family remained land women deprived basic needs due pngdfs eightyear blockade6 forced flee wilderness eke living often forcefully displaced lack discipline armies led indiscriminate rape looting7 experiences conflict galvanized women action women encouraged reconciliation individual scale persuading families cease fighting8 bougainville society matrilineal women wellrespected domestic matters bougainville women utilized status relating immediate personal impacts conflict persuade men distancing factions adhering cultural norm homemaker persuasion gave opinions weight focus irrefutable deterioration life also enabled bougainville women find common ground establishing peace opposing page 2 11 20122013 national peace essay contest villages peace marches prayer forums disarmament peace area organized bridge divide factions beginning reconciliation9 women achieved neutrality concerned hardships shared everyone rather divisive loyalties combat enabled become channels negotiation local scale peacemakers able find collective voice various conferences women factions attended global conference women 1995 700 women attended peace forum arawa10 conferences catalyzed collective action gathering individual actors together turn gave women voice formal venues inclusion bougainville women formal peacemaking limited advisory capacity11 able address gender concerns expedite negotiation position paper womens forum 1996 helped begin peace talks burnham12 attended successive peace talks women delegates published position statement signing ceasefire agreement lincoln talks addressing gender issues peace13 consistent adherence neutrality cultural roles facilitated negotiation without dissent men women worked inclusion peace talks levels contributing significantly success cote divoires civil war began amongst racial tension government drafted law designed exclude candidate popular muslim north presidential race14 troops mutinied september 2002 seizing north region attacking governmentcontrolled south leaving thousand dead15 france un troops attempted thwart rebel movement called new forces despite endofwar agreement signed july 4 2004 violence broke conflict continued sporadic battles signing second peace agreement march 4 200716 november year agreement signed president gbagbo hold elections elections finally took place 2010 6 delays second civil war broke outbreak racial political violence women among greatest victims changes legislature mean portion ivorian women stripped citizenship18 seen symbols ethnicity systematically raped rebels government forces19 victims stigmatized little justice protection offered20 though open warfare concentrated clashes rebel government forces women suffered lowered access basic necessities violence peacemaking processes dominated males conflict politically oriented issues pertinent women access water systemized sexual violence though ivorian women worked towards gender inclusion thwarted lack unity neutrality nation divided racial lines regional boundaries prevented dialogue mediation21 women could maintain neutrality issue ethnicity placed firm factions polarizing conflict hindered collective action forum bring actors together token voices given women formal negotiation22 issues page 3 11 20122013 national peace essay contest gender participation stalled peacemaking process ivorian women speaking political aspects seen usurping societal norms rejected men one regional talk abandoned men refused women included process23,0,9.248099466917514,0.3748723186925434,5.745658835546476,0.10214504596527069
nations reconciled challenge achieving national reconciliation issue great importance particularly nations bosniaherzegovina south africa countries recent years experienced brutal violations human rights evils apartheid ethnic cleansing divided populations racial ethnic lines nations reconcile grievances create peaceful future john paul lederach professor conflict studies sociology eastern mennonite university expert international peacemaking presents model reconciliation four cornerstones truth mercy peace justice although often conflict together vital components creating reconciliation1 south africas focus four fundamentals reconciliation shows approach peacemaking better assuages horrors past efforts international community balkan governments toward future bosniaherzegovina peace meaning cessation violence necessary reconciliation begin broader sense peace security safety trust ones neighbors little bosnia violence uprooted whole populations allegations horrible war crimes abound sides leaving neighbors differing ethnic groups fearful bitter balkan leaders slobodan milosevic franjo tudjman come power fanning flames ethnic hatreds introducing racist policies2 yet balkan leaders indicted war crimes un implementation force made efforts capture highprofile criminals example unofficial policy get involved many residents bosnia fear peace fail account international communitys wavering interest peacekeeping roy gutman one first international journalists report war crimes bosnia describes criticism european american leaders wasted time distracted public attention searched negotiated solution none available dampen public concerns denied visible facts another failing international community dayton peace accords reinforce spoils war mentality awarding victor areas captured nazilike policy ethnic cleansing3 peace south africa different type notable difference old regime apartheid oppression minority rule given way fully democratic government places high value human rights south africa still many deep wounds past truth reconciliation commission given safe opportunity victims speak openly pain truth another difference bosniaherzegovina south africa roy gutman describes hideously false accusations croats muslims created bosnian serb government one tract circulated bosnian serb authorities accuses muslims croats stating necklaces strung human eyes ears skulls halved brains split bowels torn etc television station pale bosniaherzegovina tells viewers nato used low intensity nuclear weapons serbs station denies evidence eye witnesses mass graves around srebrenica4 croatian national television roused viewers hatred hammering crimes croats cooperating coverups atrocities serbs5 press governmental denials many bosnians never know happened loved ones south african government hand prizes truth highly truth reconciliation commission founded reveal truth south africas horrible past offers amnesty perpetrators political crimes disclose whole truth hearings widely made public stark contrast governmental denial deception south africas past november 19 1996 93 people complied terms granted amnesty6 many families found fate loved ones commission incredible stories forgiveness reconciliation apart commission apartheidera rulers former president f w de klerk publicly apologized apartheid many important figures chosen talk past7 justice mercy difficult aspects reconciliation justice bosnia much hostage international local politics effective mercy bosnia goes numerous indicted war criminals influential arrested actions un implementation force often smalltime war criminal thing exists avoided sake local stability arresting powerful leaders radovan karadzic ratko mladic8 aspect international politics revealed statement nato generals arresting indicted war criminals worth blood one ifor soldier9 richard goldstone first chief prosecutor international war crimes tribunal earnest critic current policies toward justice bosnia said international justice used cheap commodity discarded realpolitik requires would preferable abandon justice leave victims seek revenge way10 considerable criticism justice mercy south africa well especially favor retributive justice say least south african justice today different kind restorative justice archbishop desmond tutu describes tutu chairperson truth reconciliation commission describes believes retributive justice effective tool reconciliation get justice must strive undo top dogunderdog reversals make human horror endure point exacting vengeance knowing cause future vengeance11,0,20.18489362854924,0.4059304703476483,5.4468302658486705,0.11349693251533742
