text,label,sentence_variation,%stop_word_total,mean_word_length,%adjectives_total
expanding upon exploration leveraging new media peacebuilding becomes evident transformative power digital communication platforms extends far beyond mere technological innovation new media serve catalysts human connections enabling individuals diverse backgrounds communities engage dialogue share information mobilize social change context conflict resolution peacebuilding ability new media amplify marginalized voices foster solidarity facilitate grassroots organizing holds immense potential building inclusive sustainable peace case studies egypt kenya offer valuable insights complex interplay new media peacebuilding efforts egypt utilization digital platforms facebook twitter played pivotal role mobilizing mass protests authoritarian regime hosni mubarak providing space dissent organizing informationsharing new media empowered egyptian citizens challenge status quo demand political change online activism preceded revolution tahrir square exemplifies transformative power digital connectivity galvanizing collective action shaping public discourse however egyptian revolution also underscores limitations relying solely new media achieving lasting peace digital activism played crucial role sparking initial protests subsequent transition stable democratic society required sustained efforts beyond realm online activism realworld organizing coalitionbuilding institutional reforms essential consolidating gains revolution addressing underlying causes social political unrest thus new media serve valuable tools mobilization advocacy must complemented offline strategies grassroots initiatives effect meaningful change similarly kenya role new media aftermath disputed elections 2007 highlights potential challenges leveraging digital platforms peacebuilding social media online forums used incite violence propagate hate speech also became spaces peacebuilders counteract divisive narratives promote messages reconciliation solidarity innovative use platforms like ushahidi document instances violence mobilize humanitarian responses demonstrates transformative potential new media facilitating collective action amplifying marginalized voices however kenyan case also underscores importance addressing underlying sociopolitical factors fuel conflict violence despite efforts online peacebuilders resolution crisis ultimately required political negotiations reconciliation processes structural reforms aimed addressing grievances promoting inclusive governance thus new media serve powerful tools peacebuilding panacea addressing complex conflicts require complementary strategies achieve sustainable peace elaborate role new media peacebuilding essential consider additional case studies examples different regions contexts instance arab spring movements across middle east north africa provide rich tapestry experiences new media played varying roles mobilizing protests shaping public discourse influencing political change tunisia syria digital activists utilized social media platforms organize demonstrations document human rights abuses amplify demands democratic reforms however outcomes movements mixed countries experiencing prolonged conflict authoritarian backlash highlighting complex interplay digital activism political change moreover impact new media peacebuilding also examined lens transitional justice reconciliation processes postconflict societies south africa rwanda colombia digital storytelling platforms online truth commissions virtual memorialization projects emerged innovative tools promoting healing dialogue accountability enabling survivors victims perpetrators share stories connect others engage dialogue new media platforms contribute reconciliation efforts foster sense collective memory understanding furthermore role new media addressing structural inequalities promoting social justice advancing human rights agendas cannot overlooked blacklivesmatter movement united states metoo movement globally digital activism reshaped public discourse mobilized communities challenged systems oppression discrimination amplifying marginalized voices raising awareness systemic injustices mobilizing support policy change new media become powerful tools advancing social political transformation conclusion effective leverage new media peacebuilding requires nuanced understanding potentialities limitations digital communication platforms offer unprecedented opportunities mobilization advocacy dialogue must integrated broader peacebuilding frameworks prioritize inclusivity dialogue structural transformation harnessing power new media conjunction offline strategies grassroots initiatives possible build inclusive resilient sustainable peace processes address root causes conflict promote social justice reconciliation continue navigate digital age essential harness transformative potential new media advancing peace human flourishing interconnected world,1,5.702109071808905,0.34210526315789475,6.2990430622009566,0.16267942583732056
exploring social value contemporary art contemporary art often characterized avantgarde nature willingness challenge societal norms possesses unique capacity engage pressing social issues evoke meaningful dialogue may view art detached practical concerns serve powerful tool social commentary empathybuilding community engagement sitespecific installations vehicles social commentary sitespecific installations arabella dormans suspended michael pendrys les colombes exemplify contemporary art address complex social issues within specific contexts installations transcend mere aesthetic appeal inviting viewers confront uncomfortable truths empathize marginalized communities suspended dorman utilizes clothing worn refugees symbolize plight displaced individuals seeking safety security suspending garments midair within sacred space canterbury cathedral dorman prompts viewers contemplate human stories behind clothing confront harsh realities refugee experience juxtaposition softness fabrics stone masonry cathedral creates powerful visual contrast underscoring vulnerability refugees amidst enduring strength faith tradition similarly les colombes transforms salisbury cathedral sanctuary peace reconciliation symbolic imagery origami doves pendrys installation invites viewers reflect universal desire peace freedom also acknowledging historical context conflict resilience within salisbury community visitors engage flock doves representing prayer wish peace become participants collective act solidarity hope power symbolism narrative symbolism narrative potent tools arsenal contemporary artists allowing communicate complex ideas evoke deep emotional responses viewers context sitespecific installations suspended les colombes use symbolism narrative serves amplify social impact artworks suspended arabella dorman harnesses symbolic power clothing convey human stories behind refugee crisis article clothing suspended midair becomes potent symbol displacement resilience hope choice clothing typically associated intimacy everyday life adds extra layer poignancy installation inviting viewers empathize individuals wore garments careful curation placement dorman weaves narrative speaks universal themes loss longing search belonging similarly michael pendrys les colombes utilizes symbolic imagery origami doves evoke sense peace unity collective aspiration origami doves representing prayer wish peace serve visual reminders humanitys shared longing harmony reconciliation viewers interact installation become participants communal act hope contributing wishes collective flock process pendry creates narrative solidarity mutual understanding transcends linguistic cultural boundaries contextualizing art within sacred spaces decision situate artworks like suspended les colombes within sacred spaces cathedrals adds depth resonance social commentary cathedrals rich history spiritual significance communal importance serve fitting settings artworks explore themes faith compassion human dignity suspended juxtaposition suspended clothing ancient stone walls canterbury cathedral creates powerful contrast ephemeral nature human suffering enduring strength faith cathedral history sanctuary hospitality becomes symbolic refuge displaced individuals whose stories represented installation placing artwork within sacred space dorman invites viewers reflect moral imperative compassion solidarity face adversity similarly les colombes resonates deeply within confines salisbury cathedral serves visual testament communitys resilience hope cathedral borne witness centuries triumph tragedy becomes living monument human spirit face adversity visitors engage installation reminded cathedrals role place pilgrimage contemplation reconciliation contextualization pendrys artwork transcends status mere aesthetic object becomes profound reflection enduring quest peace understanding power symbolism narrative coupled contextualization art within sacred spaces allows artworks like suspended les colombes transcend traditional boundaries artistic expression engage viewers profound acts reflection empathy solidarity continue grapple complexities modern world let us underestimate transformative potential art inspire hope foster understanding build bridges across divides conclusion art catalyst social change conclusion contemporary art immense social value catalyst empathy dialogue change sitespecific installations like suspended les colombes artists power engage viewers critical reflection issues ranging refugee rights peacebuilding reconciliation harnessing power symbolism narrative context artworks transcend traditional boundaries artistic expression invite viewers become active participants ongoing quest social justice human dignity continue grapple complexities modern world let us underestimate transformative potential art inspire hope foster understanding build bridges across divides,1,6.267245594911594,0.3806941431670282,5.919739696312364,0.11713665943600868
harnessing cultural roles womens empowerment conflict resolution lessons bougainville cote divoire intricate tapestry conflict resolution role women often overlooked yet contributions essential achieving sustainable peace cases bougainville cote divoire offer invaluable insights transformative power womens involvement peacemaking highlighting importance cultural roles unity achieving genderinclusive approaches conflict resolution bougainville triumph cultural unity nestled pacific island bougainville witnessed protracted conflict tore apart communities shattered lives bougainville conflict fueled disputes mining rights exacerbated ethnic tensions plunged region chaos nearly decade backdrop violence despair women emerged catalysts change leveraging cultural roles unity navigate path towards peace bougainville society women occupy revered position wielding influence domestic affairs community decisionmaking status homemakers caretakers imbues unique ability bridge divides foster reconciliation throughout conflict women played pivotal role persuading families eschew violence embrace dialogue drawing upon intimate understanding human cost war moreover bougainvillean women capitalized cultural norms neutrality cooperation spearhead grassroots initiatives peace peace marches prayer forums disarmament efforts transcended partisan loyalties united communities pursuit shared vision peace prosperity focusing universal hardships inflicted conflict rather divisive allegiances women became agents reconciliation paving way inclusive dialogue negotiation crucially womens inclusion formal peacemaking processes instrumental advancing gendersensitive approaches conflict resolution initially relegated advisory roles women delegates leveraged collective voice advocate gender concerns expedite negotiations position papers advocacy efforts helped shape agenda peace talks ensure womens perspectives represented negotiating table cote divoire overcoming divisions gender inclusion contrast unity demonstrated bougainville cote divoire grappled deepseated divisions along ethnic regional lines undermined efforts towards genderinclusive peacemaking outbreak civil war 2002 fueled racial tensions political turmoil exposed vulnerabilities faced ivorian women amidst chaos conflict flames violence engulfed nation women emerged primary victims subjected systemic rape displacement hands warring factions breakdown societal norms institutions left women vulnerable exploitation abuse perpetuating cycles trauma suffering despite disproportionate suffering ivorian women encountered formidable obstacles quest inclusion peacemaking processes polarizing nature conflict driven ethnic political allegiances hindered efforts unite women across divides advocate gendersensitive approaches peacebuilding ethnicity served barrier neutrality relegating women sidelines formal negotiations depriving meaningful participation shaping course peace moreover societal norms patriarchal attitudes perpetuated gender inequality relegated women subordinate roles decisionmaking processes rejection womens voices regional talks underscored entrenched resistance gender inclusion marginalizing women undermining agency conflict resolution efforts patriarchal attitudes societal norms perpetuated gender inequality marginalizing women restricting participation decisionmaking processes rejection womens voices regional talks underscored entrenched resistance gender inclusion reflecting broader pattern exclusion discrimination pervaded ivorian society despite challenges ivorian women demonstrated resilience determination quest gender inclusion peacemaking efforts grassroots initiatives womenled organizations played vital role amplifying womens voices advocating rights challenging traditional power structures demanding recognition equal stakeholders pursuit peace however road genderinclusive peacebuilding cote divoire remains fraught obstacles uncertainties addressing deepseated divisions fostering genuine reconciliation require sustained efforts bridge ethnic regional divides promote dialogue understanding empower women active agents change peacemaking process case cote divoire highlights complex interplay ethnic political gender dynamics conflict resolution efforts overcoming divisions achieving gender inclusion require concerted action commitment addressing systemic inequalities injustices ensuring voices rights individuals particularly women upheld respected pursuit lasting peace stability conclusion toward genderinclusive peacebuilding crucible conflict women emerged resilient agents change harnessing cultural roles unity advance peace reconciliation cases bougainville cote divoire underscore transformative potential womens involvement conflict resolution highlighting need gendersensitive approaches grounded cultural understanding inclusivity moving forward imperative prioritize womens participation leadership peacemaking processes recognizing unique perspectives contributions building sustainable peace harnessing cultural norms fostering unity among women overcome divisions forge pathways towards genderinclusive peacebuilding ensuring voices stakeholders heard valued pursuit equitable world,1,7.557345392911132,0.3462414578587699,6.380410022779043,0.11047835990888383
reconciliation complex multifaceted process particularly nations like bosniaherzegovina south africa deepseated divisions historical injustices left lasting scars social fabric countries strive move beyond troubled pasts forge path towards peaceful inclusive future question achieve national reconciliation looms large john paul lederach renowned expert conflict resolution proposes model reconciliation centers four key pillars truth mercy peace justice components plays vital role reconciliation process interplay often fraught tension complexity peace first cornerstone reconciliation essential creating conditions necessary dialogue healing progress bosniaherzegovina legacy war ethnic violence continues cast shadow country undermining efforts reconciliation hindering rebuilding process dayton peace accords instrumental bringing end conflict criticized reinforcing spoils war mentality perpetuating divisions grievances among various ethnic groups moreover international communitys wavering commitment peacekeeping efforts eroded trust stability region leaving many residents fearful disillusioned contrast south africa made significant strides achieving peace reconciliation aftermath apartheid transition democracy establishment truth reconciliation commission provided platform victims share stories seek justice past atrocities confronting truth dark past embracing culture transparency accountability south africa laid groundwork healing reconciliation truth second cornerstone reconciliation essential acknowledging past wrongs fostering sense collective responsibility bosniaherzegovina proliferation propaganda misinformation hindered efforts uncover truth behind atrocities committed war governmental denial deception perpetuated mistrust division among different ethnic groups making reconciliation challenging contrast south africas truth reconciliation commission played crucial role uncovering truth apartheidera crimes providing platform victims share experiences shining light dark chapters history south africa taken important step towards healing reconciliation justice mercy final cornerstones reconciliation perhaps contentious complex aspects process bosniaherzegovina pursuit justice hindered political interference lack international willpower hold war criminals accountable powerful leaders like radovan karadzic ratko mladic evaded capture smalltime perpetrators often ones face consequences actions selective approach justice fueled resentment undermined efforts reconciliation south africa concept restorative justice emerged alternative traditional retributive approaches archbishop desmond tutu chairperson truth reconciliation commission argues true reconciliation requires focus healing forgiveness rather punishment vengeance approach faced criticism advocate stricter accountability measures nevertheless played crucial role fostering dialogue reconciliation among south africans furthermore pursuit justice bosniaherzegovina overshadowed pragmatic considerations aimed maintaining stability order postwar landscape powerful leaders implicated war crimes often shielded prosecution offered lenient sentences exchange political cooperation undermining credibility justice system perpetuating culture impunity selective approach justice deepened divisions within society hindered process reconciliation victims continue seek accountability crimes committed contrast south africas approach justice truth reconciliation commission trc offers compelling model restorative justice reconciliation providing platform victims perpetrators share stories seek forgiveness grant receive amnesty trc aimed address legacy apartheidera crimes fostering healing reconciliation archbishop desmond tutus emphasis mercy forgiveness essential elements reconciliation reflects profound understanding complexities human nature need transcend cycles violence retribution trc faced criticism approach particularly advocated punitive form justice impact cannot understated prioritizing healing reconciliation punishment retribution trc created space dialogue empathy understanding laying groundwork inclusive cohesive society willingness perpetrators acknowledge actions seek forgiveness well courage victims offer forgiveness let go bitterness exemplifies transformative power reconciliation moving forward bosniaherzegovina south africa must continue grapple complexities justice mercy seek build peaceful inclusive future citizens require sustained commitment addressing root causes conflict promoting accountability transparency fostering culture empathy reconciliation embracing principles justice mercy nations forge path towards healing understanding ultimately lasting peace conclusion achieving national reconciliation requires multifaceted inclusive approach addresses root causes conflict acknowledges complexities history embracing principles truth mercy peace justice nations like bosniaherzegovina south africa pave way peaceful equitable prosperous future citizens however road reconciliation long fraught challenges require sustained commitment cooperation stakeholders involved genuine dialogue empathy understanding nations hope heal wounds past build hopeful tomorrow,1,5.538461538461539,0.4127789046653144,5.979716024340771,0.0922920892494929
